{
  "version": "cordis-surface-map.v1",
  "scope": "opl_framework_cordis_candidate_surface_map",
  "owner": "OPL Framework",
  "state": "landed/default",
  "machine_boundary": "This retains the original ten-module candidate evidence and records the landed default-profile phase. Actual plugin identities, dispositions, profiles, and cutover gates are canonical in cordis-architecture-profile.json. Cordis owns only in-process composition, service injection, typed events, fibers, and teardown; all forbidden authorities remain with their existing owners.",
  "evidence_refs": [
    "contracts/opl-framework/source-module-map.json",
    "contracts/opl-framework/module-dependency-policy.json",
    "contracts/opl-framework/brand-module-surfaces.json"
  ],
  "phase_state": {
    "cordis_adopted": true,
    "cordis_runtime_dependency_added": true,
    "default_caller_changed": true,
    "production_path_changed": true,
    "composition_snapshot_approved": true,
    "current_default_profile": "base-headless",
    "default_route": "opl.profile.base-headless"
  },
  "authority_boundary": {
    "cordis_can_own_package_installed_truth": false,
    "cordis_can_own_package_currentness": false,
    "cordis_can_own_temporal_history_or_replay": false,
    "cordis_can_own_workspace_bytes_or_registry": false,
    "cordis_can_own_ledger_evidence_or_receipts": false,
    "cordis_can_own_foundry_versions_or_activation": false,
    "cordis_can_own_domain_truth_or_quality": false,
    "cordis_can_own_app_product_truth": false,
    "cordis_is_security_sandbox": false
  },
  "global_forbidden_authorities": [
    "package_installed_truth",
    "package_currentness",
    "native_carrier_lifecycle",
    "temporal_workflow_history",
    "temporal_retry_replay",
    "workspace_file_bytes",
    "workspace_binding_registry",
    "workspace_restore_delete_authority",
    "ledger_evidence_persistence",
    "ledger_receipt_authority",
    "foundry_agent_version",
    "foundry_promotion_activation",
    "domain_truth",
    "domain_quality_verdict",
    "app_product_truth",
    "credential_material",
    "security_sandbox"
  ],
  "modules": [
    {
      "module_id": "charter",
      "brand_name": "OPL Charter",
      "module_owner": "OPL Framework",
      "public_entrypoint": "src/authority/contracts/index.ts",
      "candidate_plugin_id": "opl.charter.candidate",
      "candidate_disposition": "future_candidate_unapproved",
      "candidate_requirement": "required",
      "lifecycle_state": "not_implemented",
      "scopes": [
        "process"
      ],
      "trust_lane": "trusted_first_party_candidate",
      "candidate_rationale": "Existing callers repeatedly load the same Framework contracts; a process-scoped read service could make that dependency explicit without moving contract authority into Cordis.",
      "surface_evidence": [
        {
          "symbol": "loadFrameworkContracts",
          "declaration_ref": "src/authority/contracts/contracts.ts",
          "public_entrypoint_ref": "src/authority/contracts/index.ts",
          "caller_refs": [
            "src/host/plugins/cordis-charter-policy.ts"
          ]
        }
      ],
      "provides": [
        {
          "service_id": "opl.charter.contracts",
          "service_kind": "read_service",
          "existing_surface_symbol": "loadFrameworkContracts"
        }
      ],
      "injects": [],
      "events": [
        {
          "event_id": "opl/charter/contracts/loaded",
          "mode": "emit",
          "payload_owner": "OPL Charter",
          "payload_ref": "src/authority/contracts/contracts.ts",
          "durability": "in_process_only",
          "candidate_only": true
        }
      ],
      "continue_authoritative_surfaces": [
        {
          "authority_id": "framework_contract_language_and_owner_split",
          "owner": "OPL Charter",
          "evidence_refs": [
            "contracts/opl-framework/brand-module-registry.json",
            "contracts/opl-framework/source-module-map.json"
          ]
        }
      ],
      "forbidden_authorities": [
        "package_installed_truth",
        "domain_truth",
        "domain_quality_verdict",
        "app_product_truth"
      ]
    },
    {
      "module_id": "atlas",
      "brand_name": "OPL Atlas",
      "module_owner": "OPL Atlas",
      "public_entrypoint": "src/read-models/catalog/index.ts",
      "candidate_plugin_id": "opl.atlas.candidate",
      "candidate_disposition": "future_candidate_unapproved",
      "candidate_requirement": "optional",
      "lifecycle_state": "not_implemented",
      "scopes": [
        "process",
        "session"
      ],
      "trust_lane": "trusted_first_party_candidate",
      "candidate_rationale": "Catalog construction is already a public read surface consumed by Console, Runway, Workspace, and CLI callers, so it is a bounded discovery-service candidate.",
      "surface_evidence": [
        {
          "symbol": "buildDomainManifestCatalog",
          "declaration_ref": "src/read-models/catalog/domain-manifest/catalog-builder.ts",
          "public_entrypoint_ref": "src/read-models/catalog/index.ts",
          "caller_refs": [
            "src/host/plugins/cordis-domain-manifest-catalog.ts"
          ]
        }
      ],
      "provides": [
        {
          "service_id": "opl.atlas.catalog",
          "service_kind": "read_service",
          "existing_surface_symbol": "buildDomainManifestCatalog"
        }
      ],
      "injects": [
        {
          "service_id": "opl.charter.contracts",
          "requirement": "required",
          "evidence_refs": [
            "src/read-models/catalog/domain-launch.ts",
            "src/read-models/catalog/resolver.ts"
          ]
        }
      ],
      "events": [
        {
          "event_id": "opl/atlas/catalog/observed",
          "mode": "emit",
          "payload_owner": "OPL Atlas",
          "payload_ref": "src/read-models/catalog/domain-manifest/types.ts",
          "durability": "in_process_only",
          "candidate_only": true
        }
      ],
      "continue_authoritative_surfaces": [
        {
          "authority_id": "catalog_source_identity_and_owner_metadata",
          "owner": "OPL Atlas and the referenced Package or domain owner",
          "evidence_refs": [
            "contracts/opl-framework/brand-module-surfaces.json",
            "src/read-models/catalog/domain-manifest/catalog-builder.ts"
          ]
        }
      ],
      "forbidden_authorities": [
        "package_installed_truth",
        "package_currentness",
        "domain_truth",
        "domain_quality_verdict"
      ]
    },
    {
      "module_id": "workspace",
      "brand_name": "OPL Workspace",
      "module_owner": "OPL Workspace",
      "public_entrypoint": "src/authority/workspace/index.ts",
      "candidate_plugin_id": "opl.workspace.candidate",
      "candidate_disposition": "future_candidate_unapproved",
      "candidate_requirement": "optional",
      "lifecycle_state": "not_implemented",
      "scopes": [
        "session",
        "attempt"
      ],
      "trust_lane": "trusted_first_party_candidate",
      "candidate_rationale": "Workspace locator reads are consumed across Console, Atlas, packages, and CLI paths and can be injected per session while registry and file lifecycle stay outside Cordis.",
      "surface_evidence": [
        {
          "symbol": "resolveWorkspaceLocator",
          "declaration_ref": "src/authority/workspace/workspace-registry.ts",
          "public_entrypoint_ref": "src/authority/workspace/index.ts",
          "caller_refs": [
            "src/host/plugins/cordis-workspace-locator.ts"
          ]
        }
      ],
      "provides": [
        {
          "service_id": "opl.workspace.locator",
          "service_kind": "locator_service",
          "existing_surface_symbol": "resolveWorkspaceLocator"
        }
      ],
      "injects": [],
      "events": [
        {
          "event_id": "opl/workspace/locator/resolved",
          "mode": "emit",
          "payload_owner": "OPL Workspace",
          "payload_ref": "src/authority/workspace/workspace-registry.ts",
          "durability": "in_process_only",
          "candidate_only": true
        }
      ],
      "continue_authoritative_surfaces": [
        {
          "authority_id": "workspace_registry_bytes_and_restore_semantics",
          "owner": "OPL Workspace and the workspace or domain owner",
          "evidence_refs": [
            "src/authority/workspace/workspace-registry.ts",
            "src/authority/workspace/workspace-lifecycle.ts"
          ]
        }
      ],
      "forbidden_authorities": [
        "workspace_file_bytes",
        "workspace_binding_registry",
        "workspace_restore_delete_authority",
        "domain_truth"
      ]
    },
    {
      "module_id": "pack",
      "brand_name": "OPL Pack",
      "module_owner": "OPL Pack and Package owners",
      "public_entrypoint": "src/authority/packages/index.ts",
      "candidate_plugin_id": "opl.pack.candidate",
      "candidate_disposition": "future_candidate_unapproved",
      "candidate_requirement": "required",
      "lifecycle_state": "not_implemented",
      "scopes": [
        "process",
        "session",
        "attempt"
      ],
      "trust_lane": "trusted_first_party_candidate",
      "candidate_rationale": "Stage binding now runs through the real opl.pack.stage-binding Cordis service while the existing compiler remains the only implementation and Pack authority remains unchanged.",
      "surface_evidence": [
        {
          "symbol": "resolveStandardAgentStageQualityRuntimeBinding",
          "declaration_ref": "src/authority/packages/standard-agent-stage-manifest.ts",
          "public_entrypoint_ref": "src/authority/packages/index.ts",
          "caller_refs": [
            "src/host/plugins/cordis-pack-stage-binding-plugin.ts"
          ]
        }
      ],
      "provides": [
        {
          "service_id": "opl.pack.stage-binding",